{
  "$schema": "https://nipada.org/schema/node_v1.json",
  "nipada_id": "atom/difference",
  "type": "atom",
  "version": "§272",
  "status": "canonical",
  "meta": {
    "names": {
      "fr": "DIFFÉRENCE"
    },
    "scope": "public",
    "provenance": {
      "peirce": "Secondéité dégénérée — contraste sans direction, altérité pure",
      "jakobson": "continu/discontinu — maintenu vs pulsé (présence de bruit vs silence)",
      "dehaene": "discrimination perceptuelle — ANS (système numérique approximatif)",
      "uexkull": "Merkmal de discrimination — chaleur perçue OU odeur butyrique (chez la tique)",
      "convergences": [
        "Bateson — 'a difference that makes a difference' (Steps to an Ecology of Mind)",
        "Peirce — Secondéité dégénérée (contraste sans réaction)",
        "Saussure — valeur négative (le signe défini par ses différences)",
        "Hegel — négation interne, altérité",
        "Jakobson — trait binaire phonologique (oppositions distinctives)",
        "Shannon — bit d'information (unité de distinction)",
        "Wierzbicka NSM — OTHER / DIFFERENT (primitif universel)",
        "Uexküll — seuil de discrimination dans tout Umwelt biologique"
      ]
    }
  },
  "semantic": {
    "mode": "exact",
    "nipada_value": 3,
    "factors": [],
    "names": [
      "DIFFÉRENCE"
    ],
    "formula": "DIFFÉRENCE",
    "level": 0,
    "domain": "Z+"
  }
}