{
  "$schema": "https://nipada.org/schema/node_v1.json",
  "nipada_id": "crossing/mort",
  "type": "crossing",
  "version": "§272",
  "status": "canonical",
  "meta": {
    "names": {
      "fr": "MORT",
      "en": "DEATH",
      "sa": "mṛtyu"
    },
    "scope": "public",
    "notes": "La mort, l'inertie organique, la cessation du métabolisme. Là où VIE=30 encode l'être-différencié-en-rapport (l'organisme autopoïétique de Maturana), -30 efface ce rapport vital : l'être reste distingué (un cadavre est encore différencié) mais a perdu sa capacité de relation métabolique. La mort biologique au sens précis. | [Spencer-Brown] VIE = ÊTRE × DIFFÉRENCE × RAPPORT. Son crossing -30 : être et distingué, mais sans rapport vital. La frontière entre vie et mort est ici le rapport (5) : sa présence = autopoïèse ; son crossing = entropie progressive, désorganisation.",
    "provenance": {
      "examples": {
        "fr": [
          "mort",
          "cadavre",
          "inertie",
          "désintégration",
          "nécrose"
        ],
        "sa": [
          "mṛtyu (mort)",
          "maraṇa (processus de mourir)",
          "jarā-maraṇa (vieillesse-mort)"
        ],
        "la": [
          "mors, mortis"
        ]
      },
      "convergences": [
        "Maturana — non-autopoïèse (cessation de l'organisation vivante)",
        "Freud — pulsion de mort, Todestrieb (retour à l'inorganique)",
        "Schrödinger — entropie biologique (la mort = retour à l'équilibre thermodynamique)",
        "Derrida — la trace comme mort différée (l'écriture est mort de la voix vive)",
        "Heidegger — Sein-zum-Tode (l'être-vers-la-mort comme structure du Dasein)"
      ]
    }
  },
  "semantic": {
    "mode": "exact",
    "nipada_value": -30,
    "factors": [
      2,
      3,
      5
    ],
    "names": [
      "ÊTRE",
      "DIFFÉRENCE",
      "RAPPORT"
    ],
    "formula": "-(ÊTRE ∧ DIFFÉRENCE ∧ RAPPORT) = crossing(VIE)",
    "level": 2,
    "domain": "Z-"
  }
}